{
  "format": "ekole.kristal-visual-layer/1.0",
  "kristal_id": "qc-pri-ma-023",
  "source": {
    "contrat": "authoring/CONTRAT_PEDAGOGIQUE.json",
    "parcours": "authoring/PARCOURS.md",
    "objectif_id": "obj-1",
    "objectif_observable": "Classer des figures planes à partir de propriétés observables.",
    "concepts": [
      "côtés",
      "sommets",
      "parallélisme",
      "figure"
    ]
  },
  "titre_source": "Figures planes et propriétés",
  "politique": "Concept uniquement. Aucun style, palette, rendu, outil d’IA ou modèle graphique imposé.",
  "regle_image_manquante": "Afficher le prompt_conceptuel intégral à la place de l’image.",
  "regle_image_existante": "Afficher l’image locale si elle est valide et disponible; sinon revenir au prompt.",
  "liens_bibliotheque": {
    "composants_envisages": [
      {
        "type": "classer",
        "statut": "suggestion_de_composant_a_verifier",
        "validation": "aucune"
      }
    ],
    "scenarios_existants": []
  },
  "statut": "proposition_a_valider",
  "visuels": [
    {
      "slot": "concept",
      "placement": "decouvrir",
      "role": "illustration_de_notion",
      "concept": "côtés, sommets, parallélisme",
      "prompt_conceptuel": "Concept d'image pour le cours « Figures planes et propriétés ». Représenter des objets et supports manipulables permettant de raisonner sur la notion mathématique. Mettre en évidence les notions : côtés, sommets, parallélisme, figure. L'image doit aider à comprendre l'objectif « Classer des figures planes à partir de propriétés observables. » en montrant les éléments pertinents et leurs relations. Ne pas intégrer de question, de solution ni de texte de correction.",
      "texte_alternatif": "Illustration conceptuelle de Figures planes et propriétés : côtés, sommets, parallélisme.",
      "fichier_preferentiel": "experience/images/concept.webp",
      "formats_acceptes": [
        "webp",
        "png",
        "jpg",
        "jpeg"
      ],
      "dimensions": {
        "reglage": "manuel_ulterieur",
        "minimum_publication_px": [
          120,
          120
        ]
      },
      "statut": "prompt_en_attente_image",
      "outils_associes": [],
      "verification_pedagogique": "requise",
      "note_exactitude": "Les objets ou rapports exacts sont générés par les composants déterministes."
    },
    {
      "slot": "situation",
      "placement": "explorer",
      "role": "situation_de_transfert",
      "concept": "côtés, sommets, parallélisme",
      "prompt_conceptuel": "Concept d'image d'exploration pour « Figures planes et propriétés » : montrer une situation quotidienne où les objets peuvent être comparés, groupés ou organisés. Faire apparaître une situation ouverte où l'apprenant peut observer, comparer, décrire ou discuter côtés, sommets, parallélisme, figure. Cette image sert de point de départ à une activité liée à l'objectif « Classer des figures planes à partir de propriétés observables. ». Ne pas représenter une réponse évaluée comme déjà résolue. Contexte concret tiré de la rubrique du cours « tri par côtés »; rester ouvert sur les détails de représentation et ne pas montrer sa correction.",
      "texte_alternatif": "Situation d’exploration pour Figures planes et propriétés.",
      "fichier_preferentiel": "experience/images/situation.webp",
      "formats_acceptes": [
        "webp",
        "png",
        "jpg",
        "jpeg"
      ],
      "dimensions": {
        "reglage": "manuel_ulterieur",
        "minimum_publication_px": [
          120,
          120
        ]
      },
      "statut": "prompt_en_attente_image",
      "outils_associes": [],
      "verification_pedagogique": "requise",
      "note_exactitude": "Les objets ou rapports exacts sont générés par les composants déterministes.",
      "ancrage_contenu": {
        "fichier": "contenu/01_NOTIONS_ET_EXEMPLES.md",
        "rubrique": "tri par côtés",
        "statut": "source_du_cours"
      }
    }
  ]
}
