{
  "format": "ekole.kristal-visual-layer/1.0",
  "kristal_id": "qc-pri-eps-012",
  "source": {
    "contrat": "authoring/CONTRAT_PEDAGOGIQUE.json",
    "parcours": "authoring/PARCOURS.md",
    "objectif_id": "obj-1",
    "objectif_observable": "Analyser une pratique physique à partir de critères observables et personnels non comparatifs.",
    "concepts": [
      "objectif",
      "effort",
      "amélioration",
      "sécurité"
    ]
  },
  "titre_source": "Autoévaluation d’une pratique physique",
  "politique": "Concept uniquement. Aucun style, palette, rendu, outil d’IA ou modèle graphique imposé.",
  "regle_image_manquante": "Afficher le prompt_conceptuel intégral à la place de l’image.",
  "regle_image_existante": "Afficher l’image locale si elle est valide et disponible; sinon revenir au prompt.",
  "liens_bibliotheque": {
    "composants_envisages": [],
    "scenarios_existants": []
  },
  "statut": "proposition_a_valider",
  "visuels": [
    {
      "slot": "concept",
      "placement": "decouvrir",
      "role": "illustration_de_notion",
      "concept": "objectif, effort, amélioration",
      "prompt_conceptuel": "Concept d'image pour le cours « Autoévaluation d’une pratique physique ». Représenter un espace de mouvement, d’activité physique ou de coopération sécuritaire. Mettre en évidence les notions : objectif, effort, amélioration, sécurité. L'image doit aider à comprendre l'objectif « Analyser une pratique physique à partir de critères observables et personnels non comparatifs. » en montrant les éléments pertinents et leurs relations. Ne pas intégrer de question, de solution ni de texte de correction.",
      "texte_alternatif": "Illustration conceptuelle de Autoévaluation d’une pratique physique : objectif, effort, amélioration.",
      "fichier_preferentiel": "experience/images/concept.webp",
      "formats_acceptes": [
        "webp",
        "png",
        "jpg",
        "jpeg"
      ],
      "dimensions": {
        "reglage": "manuel_ulterieur",
        "minimum_publication_px": [
          120,
          120
        ]
      },
      "statut": "prompt_en_attente_image",
      "outils_associes": [],
      "verification_pedagogique": "requise",
      "note_exactitude": "Les objets ou rapports exacts sont générés par les composants déterministes."
    },
    {
      "slot": "situation",
      "placement": "explorer",
      "role": "situation_de_transfert",
      "concept": "objectif, effort, amélioration",
      "prompt_conceptuel": "Concept d'image d'exploration pour « Autoévaluation d’une pratique physique » : montrer une situation de déplacement ou d’action physique où les participants observent une consigne. Faire apparaître une situation ouverte où l'apprenant peut observer, comparer, décrire ou discuter objectif, effort, amélioration, sécurité. Cette image sert de point de départ à une activité liée à l'objectif « Analyser une pratique physique à partir de critères observables et personnels non comparatifs. ». Ne pas représenter une réponse évaluée comme déjà résolue. Contexte concret tiré de la rubrique du cours « guider une balle mousse sur une table »; rester ouvert sur les détails de représentation et ne pas montrer sa correction.",
      "texte_alternatif": "Situation d’exploration pour Autoévaluation d’une pratique physique.",
      "fichier_preferentiel": "experience/images/situation.webp",
      "formats_acceptes": [
        "webp",
        "png",
        "jpg",
        "jpeg"
      ],
      "dimensions": {
        "reglage": "manuel_ulterieur",
        "minimum_publication_px": [
          120,
          120
        ]
      },
      "statut": "prompt_en_attente_image",
      "outils_associes": [],
      "verification_pedagogique": "requise",
      "note_exactitude": "Les objets ou rapports exacts sont générés par les composants déterministes.",
      "ancrage_contenu": {
        "fichier": "contenu/01_NOTIONS_ET_EXEMPLES.md",
        "rubrique": "guider une balle mousse sur une table",
        "statut": "source_du_cours"
      }
    }
  ]
}
