{
  "format": "ekole.kristal-visual-layer/1.0",
  "kristal_id": "qc-pri-da-002",
  "source": {
    "contrat": "authoring/CONTRAT_PEDAGOGIQUE.json",
    "parcours": "authoring/PARCOURS.md",
    "objectif_id": "obj-1",
    "objectif_observable": "Faire varier espace, temps et énergie dans un même motif dansé.",
    "concepts": [
      "direction",
      "niveau",
      "durée",
      "intensité"
    ]
  },
  "titre_source": "Explorer espace, temps et énergie en mouvement",
  "politique": "Concept uniquement. Aucun style, palette, rendu, outil d’IA ou modèle graphique imposé.",
  "regle_image_manquante": "Afficher le prompt_conceptuel intégral à la place de l’image.",
  "regle_image_existante": "Afficher l’image locale si elle est valide et disponible; sinon revenir au prompt.",
  "liens_bibliotheque": {
    "composants_envisages": [],
    "scenarios_existants": []
  },
  "statut": "proposition_a_valider",
  "visuels": [
    {
      "slot": "concept",
      "placement": "decouvrir",
      "role": "illustration_de_notion",
      "concept": "direction, niveau, durée",
      "prompt_conceptuel": "Concept d'image pour le cours « Explorer espace, temps et énergie en mouvement ». Représenter un espace de danse où mouvement et orientation du corps sont perceptibles. Mettre en évidence les notions : direction, niveau, durée, intensité. L'image doit aider à comprendre l'objectif « Faire varier espace, temps et énergie dans un même motif dansé. » en montrant les éléments pertinents et leurs relations. Ne pas intégrer de question, de solution ni de texte de correction.",
      "texte_alternatif": "Illustration conceptuelle de Explorer espace, temps et énergie en mouvement : direction, niveau, durée.",
      "fichier_preferentiel": "experience/images/concept.webp",
      "formats_acceptes": [
        "webp",
        "png",
        "jpg",
        "jpeg"
      ],
      "dimensions": {
        "reglage": "manuel_ulterieur",
        "minimum_publication_px": [
          120,
          120
        ]
      },
      "statut": "prompt_en_attente_image",
      "outils_associes": [],
      "verification_pedagogique": "requise",
      "note_exactitude": "Les objets ou rapports exacts sont générés par les composants déterministes."
    },
    {
      "slot": "situation",
      "placement": "explorer",
      "role": "situation_de_transfert",
      "concept": "direction, niveau, durée",
      "prompt_conceptuel": "Concept d'image d'exploration pour « Explorer espace, temps et énergie en mouvement » : montrer une situation montrant une variation de geste, de rythme ou de déplacement. Faire apparaître une situation ouverte où l'apprenant peut observer, comparer, décrire ou discuter direction, niveau, durée, intensité. Cette image sert de point de départ à une activité liée à l'objectif « Faire varier espace, temps et énergie dans un même motif dansé. ». Ne pas représenter une réponse évaluée comme déjà résolue. Contexte concret tiré de la rubrique du cours « « Pinceau invisible », direction / durée / intensité »; rester ouvert sur les détails de représentation et ne pas montrer sa correction.",
      "texte_alternatif": "Situation d’exploration pour Explorer espace, temps et énergie en mouvement.",
      "fichier_preferentiel": "experience/images/situation.webp",
      "formats_acceptes": [
        "webp",
        "png",
        "jpg",
        "jpeg"
      ],
      "dimensions": {
        "reglage": "manuel_ulterieur",
        "minimum_publication_px": [
          120,
          120
        ]
      },
      "statut": "prompt_en_attente_image",
      "outils_associes": [],
      "verification_pedagogique": "requise",
      "note_exactitude": "Les objets ou rapports exacts sont générés par les composants déterministes.",
      "ancrage_contenu": {
        "fichier": "contenu/01_NOTIONS_ET_EXEMPLES.md",
        "rubrique": "« Pinceau invisible », direction / durée / intensité",
        "statut": "source_du_cours"
      }
    }
  ]
}
