{
  "format": "ekole.kristal-visual-layer/1.0",
  "kristal_id": "qc-pri-ale-007",
  "source": {
    "contrat": "authoring/CONTRAT_PEDAGOGIQUE.json",
    "parcours": "authoring/PARCOURS.md",
    "objectif_id": "obj-1",
    "objectif_observable": "Formuler une appréciation littéraire fondée sur des éléments de l’œuvre.",
    "concepts": [
      "theme",
      "narrative choice",
      "textual evidence"
    ]
  },
  "titre_source": "Apprécier la littérature de langue anglaise",
  "politique": "Concept uniquement. Aucun style, palette, rendu, outil d’IA ou modèle graphique imposé.",
  "regle_image_manquante": "Afficher le prompt_conceptuel intégral à la place de l’image.",
  "regle_image_existante": "Afficher l’image locale si elle est valide et disponible; sinon revenir au prompt.",
  "liens_bibliotheque": {
    "composants_envisages": [],
    "scenarios_existants": []
  },
  "statut": "proposition_a_valider",
  "visuels": [
    {
      "slot": "concept",
      "placement": "decouvrir",
      "role": "illustration_de_notion",
      "concept": "theme, narrative choice, textual evidence",
      "prompt_conceptuel": "Concept d'image pour le cours « Apprécier la littérature de langue anglaise ». Représenter une situation d’écoute, de lecture ou de communication en anglais. Mettre en évidence les notions : theme, narrative choice, textual evidence. L'image doit aider à comprendre l'objectif « Formuler une appréciation littéraire fondée sur des éléments de l’œuvre. » en montrant les éléments pertinents et leurs relations. Ne pas intégrer de question, de solution ni de texte de correction.",
      "texte_alternatif": "Illustration conceptuelle de Apprécier la littérature de langue anglaise : theme, narrative choice, textual evidence.",
      "fichier_preferentiel": "experience/images/concept.webp",
      "formats_acceptes": [
        "webp",
        "png",
        "jpg",
        "jpeg"
      ],
      "dimensions": {
        "reglage": "manuel_ulterieur",
        "minimum_publication_px": [
          120,
          120
        ]
      },
      "statut": "prompt_en_attente_image",
      "outils_associes": [],
      "verification_pedagogique": "requise",
      "note_exactitude": "Les objets ou rapports exacts sont générés par les composants déterministes."
    },
    {
      "slot": "situation",
      "placement": "explorer",
      "role": "situation_de_transfert",
      "concept": "theme, narrative choice, textual evidence",
      "prompt_conceptuel": "Concept d'image d'exploration pour « Apprécier la littérature de langue anglaise » : montrer une situation d’usage concret de l’anglais où des interlocuteurs cherchent à se comprendre. Faire apparaître une situation ouverte où l'apprenant peut observer, comparer, décrire ou discuter theme, narrative choice, textual evidence. Cette image sert de point de départ à une activité liée à l'objectif « Formuler une appréciation littéraire fondée sur des éléments de l’œuvre. ». Ne pas représenter une réponse évaluée comme déjà résolue.",
      "texte_alternatif": "Situation d’exploration pour Apprécier la littérature de langue anglaise.",
      "fichier_preferentiel": "experience/images/situation.webp",
      "formats_acceptes": [
        "webp",
        "png",
        "jpg",
        "jpeg"
      ],
      "dimensions": {
        "reglage": "manuel_ulterieur",
        "minimum_publication_px": [
          120,
          120
        ]
      },
      "statut": "prompt_en_attente_image",
      "outils_associes": [],
      "verification_pedagogique": "requise",
      "note_exactitude": "Les objets ou rapports exacts sont générés par les composants déterministes."
    }
  ]
}
