{
  "format": "ekole.kristal-visual-layer/1.0",
  "kristal_id": "qc-pri-mu-007",
  "source": {
    "contrat": "authoring/CONTRAT_PEDAGOGIQUE.json",
    "parcours": "authoring/PARCOURS.md",
    "objectif_id": "obj-1",
    "objectif_observable": "Interpréter une pièce avec écoute mutuelle et cohérence collective.",
    "concepts": [
      "mise en place",
      "rythme",
      "nuance",
      "coopération"
    ]
  },
  "titre_source": "Interpréter seul ou en ensemble",
  "politique": "Concept uniquement. Aucun style, palette, rendu, outil d’IA ou modèle graphique imposé.",
  "regle_image_manquante": "Afficher le prompt_conceptuel intégral à la place de l’image.",
  "regle_image_existante": "Afficher l’image locale si elle est valide et disponible; sinon revenir au prompt.",
  "liens_bibliotheque": {
    "composants_envisages": [],
    "scenarios_existants": []
  },
  "statut": "proposition_a_valider",
  "visuels": [
    {
      "slot": "concept",
      "placement": "decouvrir",
      "role": "illustration_de_notion",
      "concept": "mise en place, rythme, nuance",
      "prompt_conceptuel": "Concept d'image pour le cours « Interpréter seul ou en ensemble ». Représenter un atelier musical où une personne explore les sources sonores et l’écoute. Mettre en évidence les notions : mise en place, rythme, nuance, coopération. L'image doit aider à comprendre l'objectif « Interpréter une pièce avec écoute mutuelle et cohérence collective. » en montrant les éléments pertinents et leurs relations. Ne pas intégrer de question, de solution ni de texte de correction.",
      "texte_alternatif": "Illustration conceptuelle de Interpréter seul ou en ensemble : mise en place, rythme, nuance.",
      "fichier_preferentiel": "experience/images/concept.webp",
      "formats_acceptes": [
        "webp",
        "png",
        "jpg",
        "jpeg"
      ],
      "dimensions": {
        "reglage": "manuel_ulterieur",
        "minimum_publication_px": [
          120,
          120
        ]
      },
      "statut": "prompt_en_attente_image",
      "outils_associes": [],
      "verification_pedagogique": "requise",
      "note_exactitude": "Les objets ou rapports exacts sont générés par les composants déterministes."
    },
    {
      "slot": "situation",
      "placement": "explorer",
      "role": "situation_de_transfert",
      "concept": "mise en place, rythme, nuance",
      "prompt_conceptuel": "Concept d'image d'exploration pour « Interpréter seul ou en ensemble » : montrer une situation de pratique musicale où les interactions avec les instruments ou les sons sont visibles. Faire apparaître une situation ouverte où l'apprenant peut observer, comparer, décrire ou discuter mise en place, rythme, nuance, coopération. Cette image sert de point de départ à une activité liée à l'objectif « Interpréter une pièce avec écoute mutuelle et cohérence collective. ». Ne pas représenter une réponse évaluée comme déjà résolue. Contexte concret tiré de la rubrique du cours « « Trait d'union » : deux rôles complémentaires »; rester ouvert sur les détails de représentation et ne pas montrer sa correction.",
      "texte_alternatif": "Situation d’exploration pour Interpréter seul ou en ensemble.",
      "fichier_preferentiel": "experience/images/situation.webp",
      "formats_acceptes": [
        "webp",
        "png",
        "jpg",
        "jpeg"
      ],
      "dimensions": {
        "reglage": "manuel_ulterieur",
        "minimum_publication_px": [
          120,
          120
        ]
      },
      "statut": "prompt_en_attente_image",
      "outils_associes": [],
      "verification_pedagogique": "requise",
      "note_exactitude": "Les objets ou rapports exacts sont générés par les composants déterministes.",
      "ancrage_contenu": {
        "fichier": "contenu/01_NOTIONS_ET_EXEMPLES.md",
        "rubrique": "« Trait d'union » : deux rôles complémentaires",
        "statut": "source_du_cours"
      }
    }
  ]
}
