{
  "format": "ekole.kristal-visual-layer/1.0",
  "kristal_id": "qc-pri-us-009",
  "source": {
    "contrat": "authoring/CONTRAT_PEDAGOGIQUE.json",
    "parcours": "authoring/PARCOURS.md",
    "objectif_id": "obj-1",
    "objectif_observable": "Comparer des situations de rencontre et d’échange entre populations.",
    "concepts": [
      "échange",
      "alliance",
      "conflit",
      "perspective"
    ]
  },
  "titre_source": "Rencontres et échanges entre populations",
  "politique": "Concept uniquement. Aucun style, palette, rendu, outil d’IA ou modèle graphique imposé.",
  "regle_image_manquante": "Afficher le prompt_conceptuel intégral à la place de l’image.",
  "regle_image_existante": "Afficher l’image locale si elle est valide et disponible; sinon revenir au prompt.",
  "liens_bibliotheque": {
    "composants_envisages": [],
    "scenarios_existants": []
  },
  "statut": "proposition_a_valider",
  "visuels": [
    {
      "slot": "concept",
      "placement": "decouvrir",
      "role": "illustration_de_notion",
      "concept": "échange, alliance, conflit",
      "prompt_conceptuel": "Concept d'image pour le cours « Rencontres et échanges entre populations ». Représenter un lieu, des objets ou des traces du passé permettant de poser une question sur les sociétés. Mettre en évidence les notions : échange, alliance, conflit, perspective. L'image doit aider à comprendre l'objectif « Comparer des situations de rencontre et d’échange entre populations. » en montrant les éléments pertinents et leurs relations. Ne pas intégrer de question, de solution ni de texte de correction.",
      "texte_alternatif": "Illustration conceptuelle de Rencontres et échanges entre populations : échange, alliance, conflit.",
      "fichier_preferentiel": "experience/images/concept.webp",
      "formats_acceptes": [
        "webp",
        "png",
        "jpg",
        "jpeg"
      ],
      "dimensions": {
        "reglage": "manuel_ulterieur",
        "minimum_publication_px": [
          120,
          120
        ]
      },
      "statut": "prompt_en_attente_image",
      "outils_associes": [],
      "verification_pedagogique": "requise",
      "note_exactitude": "Les objets ou rapports exacts sont générés par les composants déterministes."
    },
    {
      "slot": "situation",
      "placement": "explorer",
      "role": "situation_de_transfert",
      "concept": "échange, alliance, conflit",
      "prompt_conceptuel": "Concept d'image d'exploration pour « Rencontres et échanges entre populations » : montrer une situation d’observation de sources, de lieux ou de relations sociales sans généralisation abusive. Faire apparaître une situation ouverte où l'apprenant peut observer, comparer, décrire ou discuter échange, alliance, conflit, perspective. Cette image sert de point de départ à une activité liée à l'objectif « Comparer des situations de rencontre et d’échange entre populations. ». Ne pas représenter une réponse évaluée comme déjà résolue. Contexte concret tiré de la rubrique du cours « Montréal, 1701 (historique, fiches de synthèse) »; rester ouvert sur les détails de représentation et ne pas montrer sa correction.",
      "texte_alternatif": "Situation d’exploration pour Rencontres et échanges entre populations.",
      "fichier_preferentiel": "experience/images/situation.webp",
      "formats_acceptes": [
        "webp",
        "png",
        "jpg",
        "jpeg"
      ],
      "dimensions": {
        "reglage": "manuel_ulterieur",
        "minimum_publication_px": [
          120,
          120
        ]
      },
      "statut": "prompt_en_attente_image",
      "outils_associes": [],
      "verification_pedagogique": "requise",
      "note_exactitude": "Les objets ou rapports exacts sont générés par les composants déterministes.",
      "ancrage_contenu": {
        "fichier": "contenu/01_NOTIONS_ET_EXEMPLES.md",
        "rubrique": "Montréal, 1701 (historique, fiches de synthèse)",
        "statut": "source_du_cours"
      }
    }
  ]
}
