{
  "format": "ekole.kristal-visual-layer/1.0",
  "kristal_id": "qc-pri-fr-010",
  "source": {
    "contrat": "authoring/CONTRAT_PEDAGOGIQUE.json",
    "parcours": "authoring/PARCOURS.md",
    "objectif_id": "obj-1",
    "objectif_observable": "Exprimer une réaction argumentée à une lecture en distinguant goûts et indices textuels.",
    "concepts": [
      "opinion",
      "critères",
      "preuves textuelles"
    ]
  },
  "titre_source": "Réagir aux textes et les apprécier",
  "politique": "Concept uniquement. Aucun style, palette, rendu, outil d’IA ou modèle graphique imposé.",
  "regle_image_manquante": "Afficher le prompt_conceptuel intégral à la place de l’image.",
  "regle_image_existante": "Afficher l’image locale si elle est valide et disponible; sinon revenir au prompt.",
  "liens_bibliotheque": {
    "composants_envisages": [],
    "scenarios_existants": []
  },
  "statut": "proposition_a_valider",
  "visuels": [
    {
      "slot": "concept",
      "placement": "decouvrir",
      "role": "illustration_de_notion",
      "concept": "opinion, critères, preuves textuelles",
      "prompt_conceptuel": "Concept d'image pour le cours « Réagir aux textes et les apprécier ». Représenter une situation de communication, de lecture ou d’écriture liée à la notion. Mettre en évidence les notions : opinion, critères, preuves textuelles. L'image doit aider à comprendre l'objectif « Exprimer une réaction argumentée à une lecture en distinguant goûts et indices textuels. » en montrant les éléments pertinents et leurs relations. Ne pas intégrer de question, de solution ni de texte de correction.",
      "texte_alternatif": "Illustration conceptuelle de Réagir aux textes et les apprécier : opinion, critères, preuves textuelles.",
      "fichier_preferentiel": "experience/images/concept.webp",
      "formats_acceptes": [
        "webp",
        "png",
        "jpg",
        "jpeg"
      ],
      "dimensions": {
        "reglage": "manuel_ulterieur",
        "minimum_publication_px": [
          120,
          120
        ]
      },
      "statut": "prompt_en_attente_image",
      "outils_associes": [],
      "verification_pedagogique": "requise",
      "note_exactitude": "Les objets ou rapports exacts sont générés par les composants déterministes."
    },
    {
      "slot": "situation",
      "placement": "explorer",
      "role": "situation_de_transfert",
      "concept": "opinion, critères, preuves textuelles",
      "prompt_conceptuel": "Concept d'image d'exploration pour « Réagir aux textes et les apprécier » : montrer une situation concrète d’échange ou d’usage de l’écrit où la compétence peut être observée. Faire apparaître une situation ouverte où l'apprenant peut observer, comparer, décrire ou discuter opinion, critères, preuves textuelles. Cette image sert de point de départ à une activité liée à l'objectif « Exprimer une réaction argumentée à une lecture en distinguant goûts et indices textuels. ». Ne pas représenter une réponse évaluée comme déjà résolue. Contexte concret tiré de la rubrique du cours « récit original : *Le banc des idées* »; rester ouvert sur les détails de représentation et ne pas montrer sa correction.",
      "texte_alternatif": "Situation d’exploration pour Réagir aux textes et les apprécier.",
      "fichier_preferentiel": "experience/images/situation.webp",
      "formats_acceptes": [
        "webp",
        "png",
        "jpg",
        "jpeg"
      ],
      "dimensions": {
        "reglage": "manuel_ulterieur",
        "minimum_publication_px": [
          120,
          120
        ]
      },
      "statut": "prompt_en_attente_image",
      "outils_associes": [],
      "verification_pedagogique": "requise",
      "note_exactitude": "Les objets ou rapports exacts sont générés par les composants déterministes.",
      "ancrage_contenu": {
        "fichier": "contenu/01_NOTIONS_ET_EXEMPLES.md",
        "rubrique": "récit original : *Le banc des idées*",
        "statut": "source_du_cours"
      }
    }
  ]
}
