{
  "format": "ekole.kristal-visual-layer/1.0",
  "kristal_id": "qc-pri-ccq-008",
  "source": {
    "contrat": "authoring/CONTRAT_PEDAGOGIQUE.json",
    "parcours": "authoring/PARCOURS.md",
    "objectif_id": "obj-1",
    "objectif_observable": "Conduire un échange avec écoute active, questions ouvertes et respect.",
    "concepts": [
      "dialogue",
      "reformulation",
      "désaccord",
      "écoute"
    ]
  },
  "titre_source": "Dialoguer et écouter avec respect",
  "politique": "Concept uniquement. Aucun style, palette, rendu, outil d’IA ou modèle graphique imposé.",
  "regle_image_manquante": "Afficher le prompt_conceptuel intégral à la place de l’image.",
  "regle_image_existante": "Afficher l’image locale si elle est valide et disponible; sinon revenir au prompt.",
  "liens_bibliotheque": {
    "composants_envisages": [],
    "scenarios_existants": []
  },
  "statut": "proposition_a_valider",
  "visuels": [
    {
      "slot": "concept",
      "placement": "decouvrir",
      "role": "illustration_de_notion",
      "concept": "dialogue, reformulation, désaccord",
      "prompt_conceptuel": "Concept d'image pour le cours « Dialoguer et écouter avec respect ». Représenter une situation de vie collective faisant apparaître plusieurs points de vue possibles. Mettre en évidence les notions : dialogue, reformulation, désaccord, écoute. L'image doit aider à comprendre l'objectif « Conduire un échange avec écoute active, questions ouvertes et respect. » en montrant les éléments pertinents et leurs relations. Ne pas intégrer de question, de solution ni de texte de correction.",
      "texte_alternatif": "Illustration conceptuelle de Dialoguer et écouter avec respect : dialogue, reformulation, désaccord.",
      "fichier_preferentiel": "experience/images/concept.webp",
      "formats_acceptes": [
        "webp",
        "png",
        "jpg",
        "jpeg"
      ],
      "dimensions": {
        "reglage": "manuel_ulterieur",
        "minimum_publication_px": [
          120,
          120
        ]
      },
      "statut": "prompt_en_attente_image",
      "outils_associes": [],
      "verification_pedagogique": "requise",
      "note_exactitude": "Les objets ou rapports exacts sont générés par les composants déterministes."
    },
    {
      "slot": "situation",
      "placement": "explorer",
      "role": "situation_de_transfert",
      "concept": "dialogue, reformulation, désaccord",
      "prompt_conceptuel": "Concept d'image d'exploration pour « Dialoguer et écouter avec respect » : montrer une rencontre ou décision collective permettant de s’interroger sur le respect et la diversité. Faire apparaître une situation ouverte où l'apprenant peut observer, comparer, décrire ou discuter dialogue, reformulation, désaccord, écoute. Cette image sert de point de départ à une activité liée à l'objectif « Conduire un échange avec écoute active, questions ouvertes et respect. ». Ne pas représenter une réponse évaluée comme déjà résolue. Contexte concret tiré de la rubrique du cours « L’affiche de bibliothèque »; rester ouvert sur les détails de représentation et ne pas montrer sa correction.",
      "texte_alternatif": "Situation d’exploration pour Dialoguer et écouter avec respect.",
      "fichier_preferentiel": "experience/images/situation.webp",
      "formats_acceptes": [
        "webp",
        "png",
        "jpg",
        "jpeg"
      ],
      "dimensions": {
        "reglage": "manuel_ulterieur",
        "minimum_publication_px": [
          120,
          120
        ]
      },
      "statut": "prompt_en_attente_image",
      "outils_associes": [],
      "verification_pedagogique": "requise",
      "note_exactitude": "Les objets ou rapports exacts sont générés par les composants déterministes.",
      "ancrage_contenu": {
        "fichier": "contenu/01_NOTIONS_ET_EXEMPLES.md",
        "rubrique": "L’affiche de bibliothèque",
        "statut": "source_du_cours"
      }
    }
  ]
}
