{
  "format": "ekole.kristal-visual-layer/1.0",
  "kristal_id": "qc-pri-us-012",
  "source": {
    "contrat": "authoring/CONTRAT_PEDAGOGIQUE.json",
    "parcours": "authoring/PARCOURS.md",
    "objectif_id": "obj-1",
    "objectif_observable": "Ordonner des changements marquants du Québec au XXe siècle.",
    "concepts": [
      "institutions",
      "société",
      "modernisation",
      "temps"
    ]
  },
  "titre_source": "Québec au XXe siècle",
  "politique": "Concept uniquement. Aucun style, palette, rendu, outil d’IA ou modèle graphique imposé.",
  "regle_image_manquante": "Afficher le prompt_conceptuel intégral à la place de l’image.",
  "regle_image_existante": "Afficher l’image locale si elle est valide et disponible; sinon revenir au prompt.",
  "liens_bibliotheque": {
    "composants_envisages": [],
    "scenarios_existants": []
  },
  "statut": "proposition_a_valider",
  "visuels": [
    {
      "slot": "concept",
      "placement": "decouvrir",
      "role": "illustration_de_notion",
      "concept": "institutions, société, modernisation",
      "prompt_conceptuel": "Concept d'image pour le cours « Québec au XXe siècle ». Représenter un lieu, des objets ou des traces du passé permettant de poser une question sur les sociétés. Mettre en évidence les notions : institutions, société, modernisation, temps. L'image doit aider à comprendre l'objectif « Ordonner des changements marquants du Québec au XXe siècle. » en montrant les éléments pertinents et leurs relations. Ne pas intégrer de question, de solution ni de texte de correction.",
      "texte_alternatif": "Illustration conceptuelle de Québec au XXe siècle : institutions, société, modernisation.",
      "fichier_preferentiel": "experience/images/concept.webp",
      "formats_acceptes": [
        "webp",
        "png",
        "jpg",
        "jpeg"
      ],
      "dimensions": {
        "reglage": "manuel_ulterieur",
        "minimum_publication_px": [
          120,
          120
        ]
      },
      "statut": "prompt_en_attente_image",
      "outils_associes": [],
      "verification_pedagogique": "requise",
      "note_exactitude": "Les objets ou rapports exacts sont générés par les composants déterministes."
    },
    {
      "slot": "situation",
      "placement": "explorer",
      "role": "situation_de_transfert",
      "concept": "institutions, société, modernisation",
      "prompt_conceptuel": "Concept d'image d'exploration pour « Québec au XXe siècle » : montrer une situation d’observation de sources, de lieux ou de relations sociales sans généralisation abusive. Faire apparaître une situation ouverte où l'apprenant peut observer, comparer, décrire ou discuter institutions, société, modernisation, temps. Cette image sert de point de départ à une activité liée à l'objectif « Ordonner des changements marquants du Québec au XXe siècle. ». Ne pas représenter une réponse évaluée comme déjà résolue. Contexte concret tiré de la rubrique du cours « Évolution des conditions électorales, puis éducation »; rester ouvert sur les détails de représentation et ne pas montrer sa correction.",
      "texte_alternatif": "Situation d’exploration pour Québec au XXe siècle.",
      "fichier_preferentiel": "experience/images/situation.webp",
      "formats_acceptes": [
        "webp",
        "png",
        "jpg",
        "jpeg"
      ],
      "dimensions": {
        "reglage": "manuel_ulterieur",
        "minimum_publication_px": [
          120,
          120
        ]
      },
      "statut": "prompt_en_attente_image",
      "outils_associes": [],
      "verification_pedagogique": "requise",
      "note_exactitude": "Les objets ou rapports exacts sont générés par les composants déterministes.",
      "ancrage_contenu": {
        "fichier": "contenu/01_NOTIONS_ET_EXEMPLES.md",
        "rubrique": "Évolution des conditions électorales, puis éducation",
        "statut": "source_du_cours"
      }
    }
  ]
}
