{
  "format": "ekole.kristal-visual-layer/1.0",
  "kristal_id": "qc-pri-fr-014",
  "source": {
    "contrat": "authoring/CONTRAT_PEDAGOGIQUE.json",
    "parcours": "authoring/PARCOURS.md",
    "objectif_id": "obj-1",
    "objectif_observable": "Repérer des groupes de mots et expliquer leurs principales fonctions dans une phrase.",
    "concepts": [
      "groupe nominal",
      "groupe verbal",
      "fonctions"
    ]
  },
  "titre_source": "Groupes de mots et fonctions syntaxiques",
  "politique": "Concept uniquement. Aucun style, palette, rendu, outil d’IA ou modèle graphique imposé.",
  "regle_image_manquante": "Afficher le prompt_conceptuel intégral à la place de l’image.",
  "regle_image_existante": "Afficher l’image locale si elle est valide et disponible; sinon revenir au prompt.",
  "liens_bibliotheque": {
    "composants_envisages": [],
    "scenarios_existants": []
  },
  "statut": "proposition_a_valider",
  "visuels": [
    {
      "slot": "concept",
      "placement": "decouvrir",
      "role": "illustration_de_notion",
      "concept": "groupe nominal, groupe verbal, fonctions",
      "prompt_conceptuel": "Concept d'image pour le cours « Groupes de mots et fonctions syntaxiques ». Représenter une situation de communication, de lecture ou d’écriture liée à la notion. Mettre en évidence les notions : groupe nominal, groupe verbal, fonctions. L'image doit aider à comprendre l'objectif « Repérer des groupes de mots et expliquer leurs principales fonctions dans une phrase. » en montrant les éléments pertinents et leurs relations. Ne pas intégrer de question, de solution ni de texte de correction.",
      "texte_alternatif": "Illustration conceptuelle de Groupes de mots et fonctions syntaxiques : groupe nominal, groupe verbal, fonctions.",
      "fichier_preferentiel": "experience/images/concept.webp",
      "formats_acceptes": [
        "webp",
        "png",
        "jpg",
        "jpeg"
      ],
      "dimensions": {
        "reglage": "manuel_ulterieur",
        "minimum_publication_px": [
          120,
          120
        ]
      },
      "statut": "prompt_en_attente_image",
      "outils_associes": [],
      "verification_pedagogique": "requise",
      "note_exactitude": "Les objets ou rapports exacts sont générés par les composants déterministes."
    },
    {
      "slot": "situation",
      "placement": "explorer",
      "role": "situation_de_transfert",
      "concept": "groupe nominal, groupe verbal, fonctions",
      "prompt_conceptuel": "Concept d'image d'exploration pour « Groupes de mots et fonctions syntaxiques » : montrer une situation concrète d’échange ou d’usage de l’écrit où la compétence peut être observée. Faire apparaître une situation ouverte où l'apprenant peut observer, comparer, décrire ou discuter groupe nominal, groupe verbal, fonctions. Cette image sert de point de départ à une activité liée à l'objectif « Repérer des groupes de mots et expliquer leurs principales fonctions dans une phrase. ». Ne pas représenter une réponse évaluée comme déjà résolue. Contexte concret tiré de la rubrique du cours « Matériel scolaire »; rester ouvert sur les détails de représentation et ne pas montrer sa correction.",
      "texte_alternatif": "Situation d’exploration pour Groupes de mots et fonctions syntaxiques.",
      "fichier_preferentiel": "experience/images/situation.webp",
      "formats_acceptes": [
        "webp",
        "png",
        "jpg",
        "jpeg"
      ],
      "dimensions": {
        "reglage": "manuel_ulterieur",
        "minimum_publication_px": [
          120,
          120
        ]
      },
      "statut": "prompt_en_attente_image",
      "outils_associes": [],
      "verification_pedagogique": "requise",
      "note_exactitude": "Les objets ou rapports exacts sont générés par les composants déterministes.",
      "ancrage_contenu": {
        "fichier": "contenu/01_NOTIONS_ET_EXEMPLES.md",
        "rubrique": "Matériel scolaire",
        "statut": "source_du_cours"
      }
    }
  ]
}
