{
  "format": "ekole.kristal-visual-layer/1.0",
  "kristal_id": "qc-pri-ma-021",
  "source": {
    "contrat": "authoring/CONTRAT_PEDAGOGIQUE.json",
    "parcours": "authoring/PARCOURS.md",
    "objectif_id": "obj-1",
    "objectif_observable": "Décrire un trajet ou une position au moyen de repères spatiaux stables.",
    "concepts": [
      "orientation",
      "coordonnées simples",
      "déplacement"
    ]
  },
  "titre_source": "Positions, déplacements et repérage",
  "politique": "Concept uniquement. Aucun style, palette, rendu, outil d’IA ou modèle graphique imposé.",
  "regle_image_manquante": "Afficher le prompt_conceptuel intégral à la place de l’image.",
  "regle_image_existante": "Afficher l’image locale si elle est valide et disponible; sinon revenir au prompt.",
  "liens_bibliotheque": {
    "composants_envisages": [
      {
        "type": "grille",
        "statut": "suggestion_de_composant_a_verifier",
        "validation": "aucune"
      }
    ],
    "scenarios_existants": []
  },
  "statut": "proposition_a_valider",
  "visuels": [
    {
      "slot": "concept",
      "placement": "decouvrir",
      "role": "illustration_de_notion",
      "concept": "orientation, coordonnées simples, déplacement",
      "prompt_conceptuel": "Concept d'image pour le cours « Positions, déplacements et repérage ». Représenter des objets et supports manipulables permettant de raisonner sur la notion mathématique. Mettre en évidence les notions : orientation, coordonnées simples, déplacement. L'image doit aider à comprendre l'objectif « Décrire un trajet ou une position au moyen de repères spatiaux stables. » en montrant les éléments pertinents et leurs relations. Ne pas intégrer de question, de solution ni de texte de correction.",
      "texte_alternatif": "Illustration conceptuelle de Positions, déplacements et repérage : orientation, coordonnées simples, déplacement.",
      "fichier_preferentiel": "experience/images/concept.webp",
      "formats_acceptes": [
        "webp",
        "png",
        "jpg",
        "jpeg"
      ],
      "dimensions": {
        "reglage": "manuel_ulterieur",
        "minimum_publication_px": [
          120,
          120
        ]
      },
      "statut": "prompt_en_attente_image",
      "outils_associes": [],
      "verification_pedagogique": "requise",
      "note_exactitude": "Les objets ou rapports exacts sont générés par les composants déterministes."
    },
    {
      "slot": "situation",
      "placement": "explorer",
      "role": "situation_de_transfert",
      "concept": "orientation, coordonnées simples, déplacement",
      "prompt_conceptuel": "Concept d'image d'exploration pour « Positions, déplacements et repérage » : montrer une situation quotidienne où les objets peuvent être comparés, groupés ou organisés. Faire apparaître une situation ouverte où l'apprenant peut observer, comparer, décrire ou discuter orientation, coordonnées simples, déplacement. Cette image sert de point de départ à une activité liée à l'objectif « Décrire un trajet ou une position au moyen de repères spatiaux stables. ». Ne pas représenter une réponse évaluée comme déjà résolue. Contexte concret tiré de la rubrique du cours « plan de la bibliothèque »; rester ouvert sur les détails de représentation et ne pas montrer sa correction.",
      "texte_alternatif": "Situation d’exploration pour Positions, déplacements et repérage.",
      "fichier_preferentiel": "experience/images/situation.webp",
      "formats_acceptes": [
        "webp",
        "png",
        "jpg",
        "jpeg"
      ],
      "dimensions": {
        "reglage": "manuel_ulterieur",
        "minimum_publication_px": [
          120,
          120
        ]
      },
      "statut": "prompt_en_attente_image",
      "outils_associes": [],
      "verification_pedagogique": "requise",
      "note_exactitude": "Les objets ou rapports exacts sont générés par les composants déterministes.",
      "ancrage_contenu": {
        "fichier": "contenu/01_NOTIONS_ET_EXEMPLES.md",
        "rubrique": "plan de la bibliothèque",
        "statut": "source_du_cours"
      }
    }
  ]
}
