{
  "format": "ekole.kristal-visual-layer/1.0",
  "kristal_id": "qc-pri-st-013",
  "source": {
    "contrat": "authoring/CONTRAT_PEDAGOGIQUE.json",
    "parcours": "authoring/PARCOURS.md",
    "objectif_id": "obj-1",
    "objectif_observable": "Comparer roches et sols à partir de caractéristiques observables.",
    "concepts": [
      "granulométrie",
      "roche",
      "sol",
      "relief"
    ]
  },
  "titre_source": "Roches, sols et relief",
  "politique": "Concept uniquement. Aucun style, palette, rendu, outil d’IA ou modèle graphique imposé.",
  "regle_image_manquante": "Afficher le prompt_conceptuel intégral à la place de l’image.",
  "regle_image_existante": "Afficher l’image locale si elle est valide et disponible; sinon revenir au prompt.",
  "liens_bibliotheque": {
    "composants_envisages": [],
    "scenarios_existants": []
  },
  "statut": "proposition_a_valider",
  "visuels": [
    {
      "slot": "concept",
      "placement": "decouvrir",
      "role": "illustration_de_notion",
      "concept": "granulométrie, roche, sol",
      "prompt_conceptuel": "Concept d'image pour le cours « Roches, sols et relief ». Représenter un environnement d’observation scientifique avec des objets ou phénomènes pertinents. Mettre en évidence les notions : granulométrie, roche, sol, relief. L'image doit aider à comprendre l'objectif « Comparer roches et sols à partir de caractéristiques observables. » en montrant les éléments pertinents et leurs relations. Ne pas intégrer de question, de solution ni de texte de correction.",
      "texte_alternatif": "Illustration conceptuelle de Roches, sols et relief : granulométrie, roche, sol.",
      "fichier_preferentiel": "experience/images/concept.webp",
      "formats_acceptes": [
        "webp",
        "png",
        "jpg",
        "jpeg"
      ],
      "dimensions": {
        "reglage": "manuel_ulterieur",
        "minimum_publication_px": [
          120,
          120
        ]
      },
      "statut": "prompt_en_attente_image",
      "outils_associes": [],
      "verification_pedagogique": "requise",
      "note_exactitude": "Les objets ou rapports exacts sont générés par les composants déterministes."
    },
    {
      "slot": "situation",
      "placement": "explorer",
      "role": "situation_de_transfert",
      "concept": "granulométrie, roche, sol",
      "prompt_conceptuel": "Concept d'image d'exploration pour « Roches, sols et relief » : montrer une situation d’investigation où l’on peut comparer un phénomène avant et après une action. Faire apparaître une situation ouverte où l'apprenant peut observer, comparer, décrire ou discuter granulométrie, roche, sol, relief. Cette image sert de point de départ à une activité liée à l'objectif « Comparer roches et sols à partir de caractéristiques observables. ». Ne pas représenter une réponse évaluée comme déjà résolue. Contexte concret tiré de la rubrique du cours « Deux exemples résolus et commentés »; rester ouvert sur les détails de représentation et ne pas montrer sa correction.",
      "texte_alternatif": "Situation d’exploration pour Roches, sols et relief.",
      "fichier_preferentiel": "experience/images/situation.webp",
      "formats_acceptes": [
        "webp",
        "png",
        "jpg",
        "jpeg"
      ],
      "dimensions": {
        "reglage": "manuel_ulterieur",
        "minimum_publication_px": [
          120,
          120
        ]
      },
      "statut": "prompt_en_attente_image",
      "outils_associes": [],
      "verification_pedagogique": "requise",
      "note_exactitude": "Les objets ou rapports exacts sont générés par les composants déterministes.",
      "ancrage_contenu": {
        "fichier": "contenu/01_NOTIONS_ET_EXEMPLES.md",
        "rubrique": "Deux exemples résolus et commentés",
        "statut": "source_du_cours"
      }
    }
  ]
}
